{
  "library_uuid": "1a103b5d-5062-4010-bb09-68b6640f3897",
  "library_title": "Campsite Judges Award",
  "type": "troop",
  "tags": [
    "#campsite"
  ],
  "content": {
    "title": "Campsite Judges Award",
    "description": "",
    "story": "",
    "instructions": "",
    "rules": [],
    "supplies": []
  },
  "scoring_model": {
    "method": "points_desc",
    "inputs": [
      {
        "id": "points",
        "label": "Points",
        "type": "number",
        "kind": "points",
        "weight": 1,
        "audience": "judge",
        "sortOrder": 900,
        "config": {
          "min": 0,
          "max": 0,
          "placeholder": ""
        }
      }
    ]
  },
  "variants": []
}