{
  "library_uuid": "def4f470-09e4-4441-a274-736bd13329be",
  "library_title": "Exhibition Game",
  "type": "exhibition",
  "tags": [
    "exhibition"
  ],
  "content": {
    "title": "Exhibition Game",
    "description": "",
    "story": "",
    "instructions": "",
    "rules": [],
    "supplies": []
  },
  "scoring_model": {
    "method": "points_desc",
    "inputs": [
      {
        "id": "patrol_spirit",
        "label": "Patrol Spirit",
        "audience": "judge",
        "sortOrder": 900,
        "config": {},
        "type": "number",
        "kind": "points",
        "weight": 1
      }
    ]
  },
  "variants": []
}