{
  "library_uuid": "7d3d60b3-da16-4a51-89f8-d4112fe3ae31",
  "library_title": "Blind Mindfield",
  "type": "patrol",
  "tags": [
    "#teamwork"
  ],
  "content": {
    "title": "Blind Mindfield",
    "description": "",
    "story": "",
    "instructions": "",
    "rules": [],
    "supplies": []
  },
  "scoring_model": {
    "method": "points_desc",
    "inputs": [
      {
        "id": "patrol_flag",
        "label": "Patrol Flag?",
        "type": "number",
        "kind": "points",
        "weight": 1,
        "audience": "judge",
        "sortOrder": 1,
        "config": {
          "min": 0,
          "max": 0,
          "placeholder": ""
        }
      },
      {
        "id": "patrol_yell",
        "label": "Patrol Yell?",
        "type": "number",
        "kind": "points",
        "weight": 1,
        "audience": "judge",
        "sortOrder": 2,
        "config": {
          "min": 0,
          "max": 0,
          "placeholder": ""
        }
      },
      {
        "id": "patrol_spirit",
        "label": "Patrol Spirit",
        "type": "number",
        "kind": "points",
        "weight": 1,
        "audience": "judge",
        "sortOrder": 3,
        "config": {
          "min": 0,
          "max": 0,
          "placeholder": ""
        }
      },
      {
        "id": "patrol_sprirt",
        "label": "Patrol Sprirt",
        "type": "number",
        "kind": "points",
        "weight": 1,
        "audience": "judge",
        "sortOrder": 900,
        "config": {
          "min": 0,
          "max": 0,
          "placeholder": ""
        }
      },
      {
        "id": "scouts_moving",
        "label": "Scouts Moving",
        "type": "number",
        "kind": "points",
        "weight": 1,
        "audience": "judge",
        "sortOrder": 900,
        "config": {
          "min": 0,
          "max": 0,
          "placeholder": ""
        }
      },
      {
        "id": "hits",
        "label": "Hits",
        "type": "number",
        "kind": "points",
        "weight": 1,
        "audience": "judge",
        "sortOrder": 900,
        "config": {
          "min": 0,
          "max": 0,
          "placeholder": ""
        }
      },
      {
        "id": "unscoutlike",
        "label": "Un-Scout-like Behavior (Penalty)",
        "type": "number",
        "kind": "points",
        "weight": -1,
        "audience": "judge",
        "sortOrder": 998,
        "config": {
          "min": 0,
          "max": 0,
          "placeholder": ""
        }
      },
      {
        "id": "judge_notes",
        "label": "Judge Notes / Comments",
        "type": "textarea",
        "kind": "points",
        "weight": 0,
        "audience": "judge",
        "sortOrder": 999,
        "config": {
          "min": 0,
          "max": 0,
          "placeholder": ""
        }
      }
    ]
  },
  "variants": []
}