{
  "library_uuid": "d82b1a02-a039-487c-9b1c-fda8a34359e2",
  "library_title": "Campsite Inspection",
  "type": "troop",
  "tags": [
    "#campsite"
  ],
  "content": {
    "title": "Campsite Inspection",
    "description": "",
    "story": "",
    "instructions": "",
    "rules": [],
    "supplies": []
  },
  "scoring_model": {
    "method": "points_desc",
    "inputs": [
      {
        "id": "u_s_and_unit_flag_posted",
        "label": "U.S. and unit flag posted",
        "type": "number",
        "kind": "points",
        "weight": 1,
        "audience": "judge",
        "sortOrder": 900,
        "config": {
          "min": 0,
          "max": 0,
          "placeholder": ""
        }
      },
      {
        "id": "gateway_or_welcome_sign_with_unit_identity",
        "label": "Gateway or welcome sign \n(with unit identity)",
        "type": "number",
        "kind": "points",
        "weight": 1,
        "audience": "judge",
        "sortOrder": 900,
        "config": {
          "min": 0,
          "max": 0,
          "placeholder": ""
        }
      },
      {
        "id": "educational_theme_poster_or_banner_on_display",
        "label": "Educational theme poster \nor banner on display",
        "type": "number",
        "kind": "points",
        "weight": 1,
        "audience": "judge",
        "sortOrder": 900,
        "config": {
          "min": 0,
          "max": 0,
          "placeholder": ""
        }
      },
      {
        "id": "theme_props_or_camp_gadgets_on_display",
        "label": "Theme props or camp \ngadgets on display",
        "type": "number",
        "kind": "points",
        "weight": 1,
        "audience": "judge",
        "sortOrder": 900,
        "config": {
          "min": 0,
          "max": 0,
          "placeholder": ""
        }
      },
      {
        "id": "overall_impression_neat_and_orderly",
        "label": "Overall impression neat \nand orderly",
        "type": "number",
        "kind": "points",
        "weight": 1,
        "audience": "judge",
        "sortOrder": 900,
        "config": {
          "min": 0,
          "max": 0,
          "placeholder": ""
        }
      },
      {
        "id": "tents_organized_by_patrols",
        "label": "Tents organized by patrols",
        "type": "number",
        "kind": "points",
        "weight": 1,
        "audience": "judge",
        "sortOrder": 900,
        "config": {
          "min": 0,
          "max": 0,
          "placeholder": ""
        }
      },
      {
        "id": "grounds_free_of_hazards_trip_hazards_marked",
        "label": "Grounds free of hazards \n(trip hazards marked)",
        "type": "number",
        "kind": "points",
        "weight": 1,
        "audience": "judge",
        "sortOrder": 900,
        "config": {
          "min": 0,
          "max": 0,
          "placeholder": ""
        }
      },
      {
        "id": "grounds_free_of_litter_including_trails_around_campsite",
        "label": "Grounds free of litter \n(including trails around campsite)",
        "type": "number",
        "kind": "points",
        "weight": 1,
        "audience": "judge",
        "sortOrder": 900,
        "config": {
          "min": 0,
          "max": 0,
          "placeholder": ""
        }
      },
      {
        "id": "personal_gear_stowed_in_tents",
        "label": "Personal gear stowed in tents",
        "type": "number",
        "kind": "points",
        "weight": 1,
        "audience": "judge",
        "sortOrder": 900,
        "config": {
          "min": 0,
          "max": 0,
          "placeholder": ""
        }
      },
      {
        "id": "tents_secured_staked_doors_zipped_rain_covered",
        "label": "Tents secured (staked, doors \nzipped, rain-covered)",
        "type": "number",
        "kind": "points",
        "weight": 1,
        "audience": "judge",
        "sortOrder": 900,
        "config": {
          "min": 0,
          "max": 0,
          "placeholder": ""
        }
      },
      {
        "id": "menus_posted_meals_well_balanced",
        "label": "Menus posted \n(meals well balanced)",
        "type": "number",
        "kind": "points",
        "weight": 1,
        "audience": "judge",
        "sortOrder": 900,
        "config": {
          "min": 0,
          "max": 0,
          "placeholder": ""
        }
      },
      {
        "id": "duty_rosters_posted_cooks_water_fire_cleanup_etc",
        "label": "Duty rosters posted \n(cooks, water, fire, cleanup, etc.)",
        "type": "number",
        "kind": "points",
        "weight": 1,
        "audience": "judge",
        "sortOrder": 900,
        "config": {
          "min": 0,
          "max": 0,
          "placeholder": ""
        }
      },
      {
        "id": "kitchen_area_and_utensils_clean",
        "label": "Kitchen area and utensils clean",
        "type": "number",
        "kind": "points",
        "weight": 1,
        "audience": "judge",
        "sortOrder": 900,
        "config": {
          "min": 0,
          "max": 0,
          "placeholder": ""
        }
      },
      {
        "id": "kitchen_fly_pitched_over_food_preparation_area",
        "label": "Kitchen fly pitched over \nfood preparation area",
        "type": "number",
        "kind": "points",
        "weight": 1,
        "audience": "judge",
        "sortOrder": 900,
        "config": {
          "min": 0,
          "max": 0,
          "placeholder": ""
        }
      },
      {
        "id": "food_storage_secured_from_animals_or_hungry_staff",
        "label": "Food storage secured from \nanimals (or hungry staff)",
        "type": "number",
        "kind": "points",
        "weight": 1,
        "audience": "judge",
        "sortOrder": 900,
        "config": {
          "min": 0,
          "max": 0,
          "placeholder": ""
        }
      },
      {
        "id": "perishable_foods_properly_refrigerated_on_ice",
        "label": "Perishable foods properly \nrefrigerated (on ice)",
        "type": "number",
        "kind": "points",
        "weight": 1,
        "audience": "judge",
        "sortOrder": 900,
        "config": {
          "min": 0,
          "max": 0,
          "placeholder": ""
        }
      },
      {
        "id": "first_aid_kit_properly_stocked_and_easily_accessible",
        "label": "First aid kit properly stocked \nand easily accessible",
        "type": "number",
        "kind": "points",
        "weight": 1,
        "audience": "judge",
        "sortOrder": 900,
        "config": {
          "min": 0,
          "max": 0,
          "placeholder": ""
        }
      },
      {
        "id": "fire_tools_at_ready_full_water_container_rake_or_shovel",
        "label": "Fire tools at ready (full water \ncontainer, rake or shovel)",
        "type": "number",
        "kind": "points",
        "weight": 1,
        "audience": "judge",
        "sortOrder": 900,
        "config": {
          "min": 0,
          "max": 0,
          "placeholder": ""
        }
      },
      {
        "id": "duff_cleared_away_from_fire_pit",
        "label": "Duff cleared away from fire pit",
        "type": "number",
        "kind": "points",
        "weight": 1,
        "audience": "judge",
        "sortOrder": 900,
        "config": {
          "min": 0,
          "max": 0,
          "placeholder": ""
        }
      },
      {
        "id": "equipment_stored_safely_axes_fuel_lanterns_stoves_etc",
        "label": "Equipment stored safely \n(axes, fuel, lanterns, stoves, etc.)",
        "type": "number",
        "kind": "points",
        "weight": 1,
        "audience": "judge",
        "sortOrder": 900,
        "config": {
          "min": 0,
          "max": 0,
          "placeholder": ""
        }
      },
      {
        "id": "garbage_contained_overflow_removed_from_site",
        "label": "Garbage contained \n(overflow removed from site)",
        "type": "number",
        "kind": "points",
        "weight": 1,
        "audience": "judge",
        "sortOrder": 900,
        "config": {
          "min": 0,
          "max": 0,
          "placeholder": ""
        }
      }
    ]
  },
  "variants": []
}