{
  "library_uuid": "d4dd08c4-3fdb-4e00-a5f6-081905cdbe27",
  "library_title": "TugOWar",
  "type": "troop",
  "tags": [
    "#sports",
    "#tugowar"
  ],
  "content": {
    "title": "TugOWar",
    "description": "",
    "story": "",
    "instructions": "",
    "rules": [],
    "supplies": []
  },
  "scoring_model": {
    "method": "points_desc",
    "inputs": [
      {
        "id": "bracket_result",
        "label": "Match Result",
        "type": "text",
        "kind": "points",
        "weight": 0,
        "audience": "judge",
        "sortOrder": 900,
        "config": {
          "min": 0,
          "max": 0,
          "placeholder": ""
        }
      },
      {
        "id": "final_rank",
        "label": "Final Ranking",
        "type": "select",
        "kind": "points",
        "weight": 0,
        "audience": "judge",
        "sortOrder": 900,
        "config": {
          "min": 0,
          "max": 0,
          "placeholder": ""
        }
      },
      {
        "id": "overall_points",
        "label": "Overall Points",
        "type": "number",
        "kind": "points",
        "weight": 1,
        "audience": "judge",
        "sortOrder": 900,
        "config": {
          "min": 0,
          "max": 0,
          "placeholder": ""
        }
      }
    ]
  },
  "variants": []
}