{
  "library_uuid": "67f18be4-4677-4756-a205-9bd49b4680be",
  "library_title": "Cooking Meal",
  "type": "troop",
  "tags": [
    "#cooking"
  ],
  "content": {
    "title": "Cooking Meal",
    "description": "",
    "story": "",
    "instructions": "",
    "rules": [],
    "supplies": []
  },
  "scoring_model": {
    "method": "points_desc",
    "inputs": [
      {
        "id": "dish",
        "label": "Dish",
        "type": "number",
        "kind": "points",
        "weight": 1,
        "audience": "judge",
        "sortOrder": 900,
        "config": {
          "min": 0,
          "max": 0,
          "placeholder": ""
        }
      },
      {
        "id": "cooking_techniques",
        "label": "Cooking Techniques",
        "type": "number",
        "kind": "points",
        "weight": 1,
        "audience": "judge",
        "sortOrder": 900,
        "config": {
          "min": 0,
          "max": 0,
          "placeholder": ""
        }
      }
    ]
  },
  "variants": []
}