{
  "library_uuid": "0be7c6e4-b6e2-4736-b771-c29c04a6093f",
  "library_title": "Mix Make Pancake",
  "type": "patrol",
  "tags": [
    "#cooking"
  ],
  "content": {
    "title": "Mix Make Pancake",
    "description": "",
    "story": "",
    "instructions": "",
    "rules": [],
    "supplies": []
  },
  "scoring_model": {
    "method": "points_desc",
    "inputs": [
      {
        "id": "patrol_flag",
        "label": "Patrol Flag?",
        "type": "number",
        "kind": "points",
        "weight": 1,
        "audience": "judge",
        "sortOrder": 1,
        "config": {
          "min": 0,
          "max": 0,
          "placeholder": ""
        }
      },
      {
        "id": "patrol_yell",
        "label": "Patrol Yell?",
        "type": "number",
        "kind": "points",
        "weight": 1,
        "audience": "judge",
        "sortOrder": 2,
        "config": {
          "min": 0,
          "max": 0,
          "placeholder": ""
        }
      },
      {
        "id": "patrol_spirit",
        "label": "Patrol Spirit",
        "type": "number",
        "kind": "points",
        "weight": 1,
        "audience": "judge",
        "sortOrder": 3,
        "config": {
          "min": 0,
          "max": 0,
          "placeholder": ""
        }
      },
      {
        "id": "mix_batter",
        "label": "Mix batter",
        "type": "number",
        "kind": "points",
        "weight": 1,
        "audience": "judge",
        "sortOrder": 900,
        "config": {
          "min": 0,
          "max": 0,
          "placeholder": ""
        }
      },
      {
        "id": "prep_skillet",
        "label": "prep skillet",
        "type": "number",
        "kind": "points",
        "weight": 1,
        "audience": "judge",
        "sortOrder": 900,
        "config": {
          "min": 0,
          "max": 0,
          "placeholder": ""
        }
      },
      {
        "id": "batter_into_skillet",
        "label": "batter into skillet",
        "type": "number",
        "kind": "points",
        "weight": 1,
        "audience": "judge",
        "sortOrder": 900,
        "config": {
          "min": 0,
          "max": 0,
          "placeholder": ""
        }
      },
      {
        "id": "pancake_resembles_fish",
        "label": "Pancake resembles Fish",
        "type": "number",
        "kind": "points",
        "weight": 1,
        "audience": "judge",
        "sortOrder": 900,
        "config": {
          "min": 0,
          "max": 0,
          "placeholder": ""
        }
      },
      {
        "id": "fully_cook_pancake",
        "label": "Fully Cook Pancake",
        "type": "number",
        "kind": "points",
        "weight": 1,
        "audience": "judge",
        "sortOrder": 900,
        "config": {
          "min": 0,
          "max": 0,
          "placeholder": ""
        }
      },
      {
        "id": "catch_eat",
        "label": "Catch & Eat....",
        "type": "number",
        "kind": "points",
        "weight": 1,
        "audience": "judge",
        "sortOrder": 900,
        "config": {
          "min": 0,
          "max": 0,
          "placeholder": ""
        }
      },
      {
        "id": "wash_and_clean_up",
        "label": "Wash and Clean up",
        "type": "number",
        "kind": "points",
        "weight": 1,
        "audience": "judge",
        "sortOrder": 900,
        "config": {
          "min": 0,
          "max": 0,
          "placeholder": ""
        }
      },
      {
        "id": "sum",
        "label": "SUM",
        "type": "number",
        "kind": "points",
        "weight": 1,
        "audience": "judge",
        "sortOrder": 900,
        "config": {
          "min": 0,
          "max": 0,
          "placeholder": ""
        }
      },
      {
        "id": "timed",
        "label": "Time\nmm:ss",
        "type": "stopwatch",
        "kind": "points",
        "weight": 1,
        "audience": "judge",
        "sortOrder": 900,
        "config": {
          "min": 0,
          "max": 0,
          "placeholder": ""
        }
      },
      {
        "id": "unscoutlike",
        "label": "Un-Scout-like Behavior (Penalty)",
        "type": "number",
        "kind": "points",
        "weight": -1,
        "audience": "judge",
        "sortOrder": 998,
        "config": {
          "min": 0,
          "max": 0,
          "placeholder": ""
        }
      },
      {
        "id": "judge_notes",
        "label": "Judge Notes / Comments",
        "type": "textarea",
        "kind": "points",
        "weight": 0,
        "audience": "judge",
        "sortOrder": 999,
        "config": {
          "min": 0,
          "max": 0,
          "placeholder": ""
        }
      }
    ]
  },
  "variants": []
}