{
  "library_uuid": "ce2f000f-8bbd-465d-8cb4-32b8a05c9b44",
  "library_title": "Walking A Frame",
  "type": "patrol",
  "tags": [
    "#lashings",
    "#teamwork"
  ],
  "content": {
    "title": "Walking A Frame",
    "description": "",
    "story": "",
    "instructions": "",
    "rules": [],
    "supplies": []
  },
  "scoring_model": {
    "method": "points_desc",
    "inputs": [
      {
        "id": "patrol_flag",
        "label": "Patrol Flag?",
        "type": "number",
        "kind": "points",
        "weight": 1,
        "audience": "judge",
        "sortOrder": 1,
        "config": {
          "min": 0,
          "max": 0,
          "placeholder": ""
        }
      },
      {
        "id": "patrol_yell",
        "label": "Patrol Yell?",
        "type": "number",
        "kind": "points",
        "weight": 1,
        "audience": "judge",
        "sortOrder": 2,
        "config": {
          "min": 0,
          "max": 0,
          "placeholder": ""
        }
      },
      {
        "id": "patrol_spirit",
        "label": "Patrol Spirit",
        "type": "number",
        "kind": "points",
        "weight": 1,
        "audience": "judge",
        "sortOrder": 3,
        "config": {
          "min": 0,
          "max": 0,
          "placeholder": ""
        }
      },
      {
        "id": "patrol_sprirt",
        "label": "Patrol Sprirt",
        "type": "number",
        "kind": "points",
        "weight": 1,
        "audience": "judge",
        "sortOrder": 900,
        "config": {
          "min": 0,
          "max": 0,
          "placeholder": ""
        }
      },
      {
        "id": "time_in_seconds",
        "label": "Time in Seconds",
        "type": "stopwatch",
        "kind": "points",
        "weight": 1,
        "audience": "judge",
        "sortOrder": 900,
        "config": {
          "min": 0,
          "max": 0,
          "placeholder": ""
        }
      },
      {
        "id": "unscoutlike",
        "label": "Un-Scout-like Behavior (Penalty)",
        "type": "number",
        "kind": "points",
        "weight": -1,
        "audience": "judge",
        "sortOrder": 998,
        "config": {
          "min": 0,
          "max": 0,
          "placeholder": ""
        }
      },
      {
        "id": "judge_notes",
        "label": "Judge Notes / Comments",
        "type": "textarea",
        "kind": "points",
        "weight": 0,
        "audience": "judge",
        "sortOrder": 999,
        "config": {
          "min": 0,
          "max": 0,
          "placeholder": ""
        }
      }
    ]
  },
  "variants": []
}