{
  "library_uuid": "6a674f41-3817-4e19-aa0f-da7ae41a816f",
  "library_title": "Carpet Puzzle",
  "type": "patrol",
  "tags": [
    "#teamwork",
    "#puzzle"
  ],
  "content": {
    "title": "Carpet Puzzle",
    "description": "",
    "story": "",
    "instructions": "",
    "rules": [],
    "supplies": []
  },
  "scoring_model": {
    "method": "points_desc",
    "inputs": [
      {
        "id": "patrol_flag",
        "label": "Patrol Flag?",
        "type": "number",
        "kind": "points",
        "weight": 1,
        "audience": "judge",
        "sortOrder": 1,
        "config": {
          "min": 0,
          "max": 0,
          "placeholder": ""
        }
      },
      {
        "id": "patrol_yell",
        "label": "Patrol Yell?",
        "type": "number",
        "kind": "points",
        "weight": 1,
        "audience": "judge",
        "sortOrder": 2,
        "config": {
          "min": 0,
          "max": 0,
          "placeholder": ""
        }
      },
      {
        "id": "patrol_spirit",
        "label": "Patrol Spirit",
        "type": "number",
        "kind": "points",
        "weight": 1,
        "audience": "judge",
        "sortOrder": 3,
        "config": {
          "min": 0,
          "max": 0,
          "placeholder": ""
        }
      },
      {
        "id": "patrol_sprirt",
        "label": "Patrol Sprirt",
        "type": "number",
        "kind": "points",
        "weight": 1,
        "audience": "judge",
        "sortOrder": 900,
        "config": {
          "min": 0,
          "max": 0,
          "placeholder": ""
        }
      },
      {
        "id": "timed",
        "label": "Time\nmm:ss",
        "type": "stopwatch",
        "kind": "points",
        "weight": 1,
        "audience": "judge",
        "sortOrder": 900,
        "config": {
          "min": 0,
          "max": 0,
          "placeholder": ""
        }
      },
      {
        "id": "unscoutlike",
        "label": "Un-Scout-like Behavior (Penalty)",
        "type": "number",
        "kind": "points",
        "weight": -1,
        "audience": "judge",
        "sortOrder": 998,
        "config": {
          "min": 0,
          "max": 0,
          "placeholder": ""
        }
      },
      {
        "id": "judge_notes",
        "label": "Judge Notes / Comments",
        "type": "textarea",
        "kind": "points",
        "weight": 0,
        "audience": "judge",
        "sortOrder": 999,
        "config": {
          "min": 0,
          "max": 0,
          "placeholder": ""
        }
      }
    ]
  },
  "variants": []
}