{
  "library_uuid": "4a646fa0-bb68-4905-bf6c-33590139f45b",
  "library_title": "Fire to Water",
  "type": "patrol",
  "tags": [
    "#fire",
    "#teamwork"
  ],
  "content": {
    "title": "Fire to Water",
    "description": "",
    "story": "",
    "instructions": "",
    "rules": [],
    "supplies": []
  },
  "scoring_model": {
    "inputs": [
      {
        "id": "patrol_flag",
        "label": "Patrol Flag?",
        "type": "number",
        "weight": 1,
        "max_points": 5,
        "placeholder": "",
        "sortOrder": 1
      },
      {
        "id": "patrol_yell",
        "label": "Patrol Yell?",
        "type": "number",
        "weight": 1,
        "max_points": 5,
        "placeholder": "",
        "sortOrder": 2
      },
      {
        "id": "patrol_spirit",
        "label": "Patrol Spirit",
        "type": "number",
        "weight": 1,
        "max_points": 5,
        "placeholder": "",
        "sortOrder": 3
      },
      {
        "id": "attempt_friction_fire",
        "label": "Attempt Friction Fire",
        "type": "number",
        "weight": 1,
        "max_points": 5,
        "placeholder": "",
        "sortOrder": 900
      },
      {
        "id": "charing_or_powder",
        "label": "charing or powder",
        "type": "number",
        "weight": 1,
        "max_points": 5,
        "placeholder": "",
        "sortOrder": 900
      },
      {
        "id": "smoke",
        "label": "smoke",
        "type": "number",
        "weight": 1,
        "max_points": 5,
        "placeholder": "",
        "sortOrder": 900
      },
      {
        "id": "ember",
        "label": "ember",
        "type": "number",
        "weight": 1,
        "max_points": 5,
        "placeholder": "",
        "sortOrder": 900
      },
      {
        "id": "ignite_tinder",
        "label": "Ignite tinder",
        "type": "number",
        "weight": 1,
        "max_points": 5,
        "placeholder": "",
        "sortOrder": 900
      },
      {
        "id": "ignite_kindling",
        "label": "ignite kindling",
        "type": "number",
        "weight": 1,
        "max_points": 5,
        "placeholder": "",
        "sortOrder": 900
      },
      {
        "id": "water_boils",
        "label": "water boils",
        "type": "number",
        "weight": 1,
        "max_points": 5,
        "placeholder": "",
        "sortOrder": 900
      },
      {
        "id": "extinguish_fire_reset",
        "label": "Extinguish fire & reset",
        "type": "number",
        "weight": 1,
        "max_points": 5,
        "placeholder": "",
        "sortOrder": 900
      },
      {
        "id": "matches_used_count",
        "label": "Matches Used\n(Count)",
        "type": "number",
        "weight": 0,
        "max_points": 20,
        "placeholder": "",
        "sortOrder": 900
      },
      {
        "id": "matches_score",
        "label": "Matches points\n",
        "type": "number",
        "weight": 1,
        "max_points": 0,
        "placeholder": "",
        "sortOrder": 900
      },
      {
        "id": "time_to_boil",
        "label": "Time to Boil or N.A.\n\nmm:ss",
        "type": "stopwatch",
        "weight": 0,
        "max_points": 0,
        "placeholder": "",
        "sortOrder": 900
      },
      {
        "id": "time_to_boil_score",
        "label": "Boil time Bonus",
        "type": "number",
        "weight": 1,
        "max_points": 0,
        "placeholder": "",
        "sortOrder": 900
      },
      {
        "id": "judges_points_calc",
        "label": "Calculated Points",
        "type": "number",
        "weight": 1,
        "max_points": 0,
        "placeholder": "",
        "sortOrder": 900
      },
      {
        "id": "unscoutlike",
        "label": "Un-Scout-like Behavior (Penalty)",
        "type": "number",
        "weight": -1,
        "max_points": 100,
        "placeholder": "",
        "sortOrder": 998
      },
      {
        "id": "judge_notes",
        "label": "Judge Notes / Comments",
        "type": "textarea",
        "weight": 0,
        "max_points": 0,
        "placeholder": "Optional notes on performance...",
        "sortOrder": 999
      }
    ]
  },
  "variants": []
}